{
  "schema_version": "owner-price-series.v1",
  "source_version": "example-v1",
  "instrument_id": "instrument_aapl",
  "symbol": "AAPL",
  "venue": "XNAS",
  "currency": "USD",
  "price_adjustment": "unadjusted",
  "sample": true,
  "fetched_at": "2026-01-01T00:00:00Z",
  "points": [
    {
      "observed_at": "2025-01-01T00:00:00Z",
      "price": "100"
    },
    {
      "observed_at": "2026-01-01T00:00:00Z",
      "price": "200"
    }
  ]
}
